Product_Name, Price
Epson L380 Multi-function Printer,Rs10699
Epson L3150 Multi-function Wireless Printer,Rs12899
Epson L3110 Multi-function Printer,Rs10499
Epson L360 Multi-function Inkjet Printer,Rs11399
Epson L6170 Multi-function Wireless Printer,Rs21299
Epson L4160 Multi-function Wireless Printer,Rs16999
Epson L565 Multi-function Wireless Printer,Rs16499
Epson L6160 Multi-function Wireless Printer,Rs19999
Epson L130 Single Function Inkjet Printer,Rs8630
Epson L4150 Multi-function Wireless Printer,Rs15499
Epson M200 Multi Function Printer,Rs12999
Epson L220 Multi-function Inkjet Printer,Rs10999
Epson M205 Multi-function Wireless Printer,Rs14599
Epson EcoTank L3110 Multi-function Printer,Rs10899
Epson L6190 Multi-function Wireless Printer,Rs23499
Epson PictureMate PM-520 Single Function Wireless Print...,Rs15245
Epson M100 Single Function Inkjet Printer,Rs8795
Epson L130 Single Function Printer,Rs8599
Epson - LQ-310 Single Function Impact Dot Matrix Printe...,Rs13299
Epson EPSON_M205_PRINTER Multi-function Wireless Printe...,Rs15299
Epson L805 Single Function Wireless Printer,Rs17499
Epson Ink Tank M200 Multi-function Printer,Rs13950
Epson Inkjet printer L360 Multi-function Printer,Rs11399
Epson L605 Multi-function Wireless Printer,Rs22020
Epson Ink Tank L310 Single Function Printer,Rs9023
Epson Ink Tank M105 Single Function Wireless Printer,Rs9499
Epson M200 Multi-function Printer,Rs13995
